<?xml version="1.0"?>
<xs:schema xmlns:xs="http://www.w3.org/2001/XMLSchema"
targetNamespace="http://www.w3school.com.cn"
xmlns="http://www.w3school.com.cn"
elementFormDefault="qualified">

<xs:element name="sslRoute">
    <xs:complexType>
      <xs:sequence>
	    <xs:element name="row" maxOccurs="unbounded">
          <xs:complexType>
            <xs:sequence>
              <xs:element name="entry" type="xs:string"
              minOccurs="3" maxOccurs="3"/>
            </xs:sequence>
          </xs:complexType>
        </xs:element>
      </xs:sequence>
    </xs:complexType>
</xs:element>

</xs:schema>
